<?xml version="1.0" encoding="UTF-8"?>
<dmodule xmlns:xsi="http://www.w3.org/2001/XMLSchema-instance"
         xsi:noNamespaceSchemaLocation="../../schemas/brex.xsd">
  <identAndStatusSection>
    <dmAddress>
      <dmIdent>
        <dmCode modelIdentCode="BWQ1" systemDiffCode="A"
                systemCode="00" subSystemCode="00" subSubSystemCode="00"
                assyCode="00" disassyCode="00" disassyCodeVariant="A"
                infoCode="022" infoCodeVariant="A" itemLocationCode="D"/>
        <language languageIsoCode="en" countryIsoCode="US"/>
        <issueInfo issueNumber="001" inWork="01"/>
      </dmIdent>
      <dmAddressItems>
        <issueDate year="2025" month="09" day="22"/>
        <dmTitle>
          <techName>BWB-Q100</techName>
          <infoName>BREX — Project business rules (IC 022)</infoName>
        </dmTitle>
      </dmAddressItems>
    </dmAddress>
    <dmStatus issueType="new">
    <security securityClassification="01"/>
  </dmStatus>
  </identAndStatusSection>

  <content>
    <rules>
      <ruleGroup>
        <brParas>
          <brPara><brTitle>MIC</brTitle><brText>Use BWQ1 (A–Z, 0–9 only).</brText></brPara>
          <brPara><brTitle>Classification</brTitle><brText>Use INTERNAL–EVIDENCE-REQUIRED (en dash).</brText></brPara>
          <brPara><brTitle>Schema</brTitle><brText>XSD only; no DTD.</brText></brPara>
        </brParas>
      </ruleGroup>
    </rules>
  </content>
</dmodule>